{
  "format": "nsealr-route-selection-vector-v0",
  "name": "esp32-usb-sign-event-slot-0",
  "request": {
    "account_id": "acct-esp32-usb-slot-0",
    "method": "sign_event",
    "route_type": "esp32_usb_nip46"
  },
  "selection": {
    "account_id": "acct-esp32-usb-slot-0",
    "contains_secret_material": false,
    "custody": "device_persistent",
    "format": "nsealr-route-selection-v0",
    "persistent_grants": true,
    "physical_approval": true,
    "physical_review": true,
    "policy_profile_id": "policy-manual-only-persistent-device",
    "policy_support": "scoped_automation",
    "public_key": "4f355bdcb7cc0af728ef3cceb9615d90684bb5b2ca5f859ab0f0b704075871aa",
    "repository": "nsealr",
    "route_type": "esp32_usb_nip46",
    "transport": "usb",
    "trusted_review": "device_display"
  }
}
